{"commands":{"triage_w3_AH-20260915-3218A00AAEFB":{"authorityDecision":{"action":"triage-harness-issues","actor":"project-owner","decision":"approved","source":"current-thread"},"commandId":"triage_w3_AH-20260915-3218A00AAEFB","committedAt":"2026-09-23T00:20:02.309Z","payloadDigest":"54079f8e3649248733e5f2ef1ee85c25ec5ab0f9a1b65638b03fba07d56dac25","revision":1}},"disposition":{"classification":"defect","relations":[{"target":"AH-20260914-E31036D1068A","type":"related-to"},{"target":"AH-20260915-8C001F4D266E","type":"related-to"}],"resolutionEvidence":["implementation-report:AH-20260915-3218A00AAEFB/implementation-report.md"],"severity":"P1","status":"accepted","summary":"5eeba78 引入的 action-scoped headless 覆盖绕过交互式可见宿主边界；已由 LifecycleExecutionGrant 与执行策略修复，外部 Gate 未执行。"},"issueId":"AH-20260915-3218A00AAEFB","protocolVersion":"1.0","revision":1,"triageDigest":"e29368fba87461b75c42773851a1a3f2fb2e81e4d91b86e66ac2d0074d19b98e","updatedAt":"2026-09-23T00:20:02.309Z"}
