{"commands":{"triage_AH_20260913_6747BDDA11DB":{"authorityDecision":{"action":"close-related-harness-issues","actor":"project-owner","decision":"approved","source":"current-thread"},"commandId":"triage_AH_20260913_6747BDDA11DB","committedAt":"2026-09-13T14:53:26.570Z","payloadDigest":"4ffb3dc51d03bc5f12c910de31ba73b9269b120b51c55877e63f560e2f7dc731","revision":1},"triage_AH_20260913_6747BDDA11DB_final":{"authorityDecision":{"action":"close-related-harness-issues","actor":"project-owner","decision":"approved","source":"current-thread"},"commandId":"triage_AH_20260913_6747BDDA11DB_final","committedAt":"2026-09-13T14:56:01.605Z","payloadDigest":"771f0e25c8326c7a78c81724f799e5160720c0dcd554938a77692f10b43560cf","revision":2}},"disposition":{"classification":"deployment-incident","relations":[{"target":"AH-20260913-DA8CA73021DB","type":"successor-of"},{"target":"AH-20260913-AB2DBEDCE37B","type":"related-to"},{"target":"bootstrap-receipt:cf61735fedbfe64cb1450d73199b413e83c77299e7f86f96c4a3121f37518ae5","type":"fixed-by"}],"resolutionEvidence":["harness-artifact:79039301b36ac34a3243c0106615fbd9d84abe5dbf3033cbd8c71ad88f9a469b","bootstrap-plan:ac30b967ba87a6bfbce32c84943f36d89db198942291d0bce13096897aed52fc","bootstrap-receipt:cf61735fedbfe64cb1450d73199b413e83c77299e7f86f96c4a3121f37518ae5","doctor:cardworld-engine:lifecycleReady=true;descriptorRevision=2;extensionRegistryRevision=4","test:npm-test:108/108","gate:check=pass;clean-room=pass;pack-dry-run=pass;residue=pass","attestation:runCreated=false"],"severity":"P1","status":"closed","summary":"活动数据根已通过受批准、幂等、可恢复的 Bootstrap 初始化；最终 Harness 制品摘要下的 Engine 项目级 lifecycle readiness 已验证为 true，且未创建 Run。"},"issueId":"AH-20260913-6747BDDA11DB","protocolVersion":"1.0","revision":2,"triageDigest":"f4ac94c13c8bdf94a6fa03c63e60f726fde0b06679dc4e065707c84655ede7b8","updatedAt":"2026-09-13T14:56:01.605Z"}
