{"commands":{"triage_w3_AH-20260914-C27838A16DA6":{"authorityDecision":{"action":"triage-harness-issues","actor":"project-owner","decision":"approved","source":"current-thread"},"commandId":"triage_w3_AH-20260914-C27838A16DA6","committedAt":"2026-09-23T00:20:02.283Z","payloadDigest":"e48378654d091481de7db9e005ea7f2a0b4afe27303242a88e19f502c4d834aa","revision":1}},"disposition":{"classification":"defect","relations":[{"target":"AH-20260920-AB121AD18464","type":"related-to"},{"target":"AH-20260920-D5F65D00699B","type":"related-to"}],"resolutionEvidence":[],"severity":"P1","status":"accepted","summary":"codex-cli 三次未产出受管 result.json 导致 V3.8.4 quality Runtime 失败；已由 Runtime 结果契约与受管输出收口修复，真实 Codex 宿主复验仍待执行。"},"issueId":"AH-20260914-C27838A16DA6","protocolVersion":"1.0","revision":1,"triageDigest":"61d65ee74e0e60a346c21e4b7a411c847f8a9b889ad2fc462ab396a5e33d9f6e","updatedAt":"2026-09-23T00:20:02.283Z"}
