{"commands":{"triage_AH_20260913_DA8CA73021DB":{"authorityDecision":{"action":"close-related-harness-issues","actor":"project-owner","decision":"approved","source":"current-thread"},"commandId":"triage_AH_20260913_DA8CA73021DB","committedAt":"2026-09-13T14:53:26.557Z","payloadDigest":"bae7aa62aa0490e49352be271f97e846e6330ff15923d50dc5b09b314cac6f55","revision":1}},"disposition":{"classification":"defect","relations":[{"target":"commit:68a9e4cc1b5f22569063c8ae056c4e2ccb8b21bc","type":"fixed-by"},{"target":"AH-20260913-6747BDDA11DB","type":"related-to"}],"resolutionEvidence":["commit:68a9e4cc1b5f22569063c8ae056c4e2ccb8b21bc","test:npm-test:108/108","test:project-list-and-run-status-zero-write-and-no-extension-import"],"severity":"P2","status":"resolved","summary":"只读查询隐式初始化数据根的代码缺陷已修复，并由读路径负向测试覆盖。"},"issueId":"AH-20260913-DA8CA73021DB","protocolVersion":"1.0","revision":1,"triageDigest":"4b1152c361f0d6ea4bac002d753ba943736d8f6e1b56eb530e051f8dd982dc08","updatedAt":"2026-09-13T14:53:26.557Z"}
