{"commands":{"triage_w3_AH-20260916-7C7B43E926D2":{"authorityDecision":{"action":"triage-harness-issues","actor":"project-owner","decision":"approved","source":"current-thread"},"commandId":"triage_w3_AH-20260916-7C7B43E926D2","committedAt":"2026-09-23T00:20:02.367Z","payloadDigest":"654c2f5ae36e3fa12ef2bb55edf5177ed292005969f9fd006caae6c6e3444b5f","revision":1}},"disposition":{"classification":"defect","relations":[{"target":"AH-20260920-A79DB71DEA40","type":"related-to"}],"resolutionEvidence":[],"severity":"P1","status":"accepted","summary":"review-and-repair 被解析为只读 Feature，未进入修复阶段；已由质量修复执行路径修复，真实宿主复验待执行。"},"issueId":"AH-20260916-7C7B43E926D2","protocolVersion":"1.0","revision":1,"triageDigest":"15624e9fd9a228b494098f0009b395577610dbb4027ebd8a1a885db968769a99","updatedAt":"2026-09-23T00:20:02.367Z"}
