{"commands":{"triage_AH_20260915_68116284F352_binding_fallback_resolve":{"authorityDecision":{"action":"resolve-related-harness-issues","actor":"project-owner","decision":"approved","source":"current-thread"},"commandId":"triage_AH_20260915_68116284F352_binding_fallback_resolve","committedAt":"2026-09-15T03:45:49.377Z","payloadDigest":"8e832c40cae95956030da1b3dbd96dd0b437b9d9b4fc6897578b28e6171cde37","revision":2},"triage_AH_20260915_68116284F352_resolve":{"authorityDecision":{"action":"resolve-related-harness-issues","actor":"project-owner","decision":"approved","source":"current-thread"},"commandId":"triage_AH_20260915_68116284F352_resolve","committedAt":"2026-09-15T03:26:37.428Z","payloadDigest":"b85ede3f1e491b9dad6e53cb3c32fa6250d7ad36295d26989afee65a256a8275","revision":1},"triage_w3_reopen_AH-20260915-68116284F352":{"authorityDecision":{"action":"triage-harness-issues","actor":"project-owner","decision":"approved","source":"current-thread"},"commandId":"triage_w3_reopen_AH-20260915-68116284F352","committedAt":"2026-09-23T00:20:02.422Z","payloadDigest":"ef61f18ac8efb802286e0e388cebba249afe58c6b327444d15e28d95d04c6c09","revision":3}},"disposition":{"classification":"defect","relations":[{"target":"AH-20260915-8C001F4D266E","type":"related-to"},{"target":"AH-20260915-4EC6FD529BAA","type":"related-to"}],"resolutionEvidence":["issue-analysis:AH-20260915-8C001F4D266E/resolution-plan.md"],"severity":"P1","status":"reopened","summary":"原 resolved 后同一故障 16 分钟内复发，绑定恢复修复未覆盖真实宿主桥；重新开放待复验。"},"issueId":"AH-20260915-68116284F352","protocolVersion":"1.0","revision":3,"triageDigest":"8182fcfbeed9fa30e3f8243e5c25576a287794429b5a8cdc0996facce4702702","updatedAt":"2026-09-23T00:20:02.422Z"}
