{"commands":{"triage_AH_20260914_E31036D1068A_accept":{"authorityDecision":{"action":"issue-triage","actor":"project-owner","decision":"approved","id":"approve-triage-AH-20260914-E31036D1068A","source":"current-thread"},"commandId":"triage_AH_20260914_E31036D1068A_accept","committedAt":"2026-09-14T12:17:01.457Z","payloadDigest":"3baaa64a2660708fbd5701ddfa8e44e47f16c62bf3e837b7bf519354bc0fff17","revision":1}},"disposition":{"classification":"defect","relations":[{"target":"AH-20260913-6747BDDA11DB","type":"successor-of"},{"target":"AH-20260914-B5475E479753","type":"related-to"},{"target":"issues/AH-20260914-E31036D1068A/resolution-plan.md","type":"related-to"}],"resolutionEvidence":[],"severity":"P1","status":"accepted","summary":"已确认上游复合缺陷：发布制品轮换缺少独立且原子化的激活事务，导致下一次业务生命周期命令承担 Bootstrap 授权；同时伪命令只解析 Intent，未生成确定性的 Run/Feature/Profile/Gate 计划，使模型构造 Run 并误继承全流程 canonical requirement 与 user code review 前置条件。当前 Engine readiness 已恢复，但遗留 r2 为零 Dispatch 的错误配置审计样本。修复应引入版本化 Lifecycle Command Plan、按动作固化 quality/full 配置、发布激活 generation/active-pointer 事务，并保留受保护操作的独立批准边界。"},"issueId":"AH-20260914-E31036D1068A","protocolVersion":"1.0","revision":1,"triageDigest":"24a11f5e9c688d35272fbeaa397ac21a86e08fbdb0f6f5f4f57ef6b446b28864","updatedAt":"2026-09-14T12:17:01.457Z"}
