{"commands":{"triage_w3_AH-20260915-7007E9BFAFD4":{"authorityDecision":{"action":"triage-harness-issues","actor":"project-owner","decision":"approved","source":"current-thread"},"commandId":"triage_w3_AH-20260915-7007E9BFAFD4","committedAt":"2026-09-23T00:20:02.342Z","payloadDigest":"a10eed1d8b4596349ffc0fe6abc56b2333097de02b13fdc29eb7563a601aef69","revision":1}},"disposition":{"classification":"defect","relations":[{"target":"AH-20260915-8C001F4D266E","type":"related-to"}],"resolutionEvidence":["resolution-plan:AH-20260915-7007E9BFAFD4/resolution-plan.md","test:npm-test:173/173","source:RunLineageResolver;RecoveryResolutionReceipt"],"severity":"P2","status":"resolved","summary":"Run lineage 选择不再暴露给用户，由 RunLineageResolver 与 RecoveryResolutionReceipt 按 Authority 与策略确定性裁决；源码与包已验证。"},"issueId":"AH-20260915-7007E9BFAFD4","protocolVersion":"1.0","revision":1,"triageDigest":"46f30819d9900d8124092129830b159ad000e4d6aeaa4bcc1f9cd209552032d5","updatedAt":"2026-09-23T00:20:02.342Z"}
