{"commands":{"triage_w3_AH-20260915-4EC6FD529BAA":{"authorityDecision":{"action":"triage-harness-issues","actor":"project-owner","decision":"approved","source":"current-thread"},"commandId":"triage_w3_AH-20260915-4EC6FD529BAA","committedAt":"2026-09-23T00:20:02.332Z","payloadDigest":"0c97093dbef6d460174ba39b6e6b56eb244773ed771132814c5d283e5852d869","revision":1}},"disposition":{"classification":"defect","relations":[{"target":"AH-20260915-68116284F352","type":"related-to"},{"target":"AH-20260915-8C001F4D266E","type":"related-to"}],"resolutionEvidence":[],"severity":"P1","status":"accepted","summary":"conversation-visible Lease 绑定缺少可信宿主 attestation；已由宿主验证适配器与 fail-closed 路径覆盖，真实宿主复验待执行。"},"issueId":"AH-20260915-4EC6FD529BAA","protocolVersion":"1.0","revision":1,"triageDigest":"066d9a59a6ad4c9ac46bf7f6858b19d7b5ea579e0f029f368358403ea7e71557","updatedAt":"2026-09-23T00:20:02.332Z"}
