{"commands":{"triage_w3_AH-20260920-A79DB71DEA40":{"authorityDecision":{"action":"triage-harness-issues","actor":"project-owner","decision":"approved","source":"current-thread"},"commandId":"triage_w3_AH-20260920-A79DB71DEA40","committedAt":"2026-09-23T00:20:02.378Z","payloadDigest":"fff229f103c6f6797426962e0966846045049698eb567e257f725b9acb5cbefc","revision":1}},"disposition":{"classification":"defect","relations":[{"target":"AH-20260920-AB121AD18464","type":"related-to"},{"target":"AH-20260920-D5F65D00699B","type":"related-to"}],"resolutionEvidence":[],"severity":"P1","status":"accepted","summary":"质量结果验收未按权威开放 Finding 清单强制完整性；已由 KnownFindingInventory 与完整性校验修复，真实宿主复验待执行。"},"issueId":"AH-20260920-A79DB71DEA40","protocolVersion":"1.0","revision":1,"triageDigest":"6ca88f9673550344a07ca37a9384c6ef8ae89f0f1bc64e6bb985f853335711e6","updatedAt":"2026-09-23T00:20:02.378Z"}
