{"commands":{"triage_w3_AH-20260920-AB121AD18464":{"authorityDecision":{"action":"triage-harness-issues","actor":"project-owner","decision":"approved","source":"current-thread"},"commandId":"triage_w3_AH-20260920-AB121AD18464","committedAt":"2026-09-23T00:20:02.390Z","payloadDigest":"cba5f2997e408d72280eea1672ddecad569f3c01a62be1089d4192da3612c6f5","revision":1}},"disposition":{"classification":"defect","relations":[{"target":"AH-20260920-D5F65D00699B","type":"related-to"},{"target":"AH-20260920-A79DB71DEA40","type":"related-to"}],"resolutionEvidence":["implementation-report:AH-20260920-AB121AD18464/implementation-report.md","test:npm-test:227/227"],"severity":"P1","status":"accepted","summary":"可见质量复核结果被 Harness 以 Schema 不合法拒绝，无法进入修复闭环；代码候选通过 227/227，真实 Codex 宿主与业务准出未执行。"},"issueId":"AH-20260920-AB121AD18464","protocolVersion":"1.0","revision":1,"triageDigest":"9a14ba47023e677402d4dcaae89c8a9befcce5bb9324032e611b47faa5d0e061","updatedAt":"2026-09-23T00:20:02.390Z"}
