{"commands":{"triage_AH_20260914_B5475E479753_accept":{"authorityDecision":{"action":"issue-triage","actor":"project-owner","decision":"approved","id":"approve-triage-AH-20260914-B5475E479753","source":"current-thread"},"commandId":"triage_AH_20260914_B5475E479753_accept","committedAt":"2026-09-14T11:21:27.489Z","payloadDigest":"07e8c68655b16701f4e2cede22474a680514dcf4bcfb1df88194485638607580","revision":1}},"disposition":{"classification":"defect","relations":[],"resolutionEvidence":[],"severity":"P1","status":"accepted","summary":"Confirmed upstream codex-runtime Agent Runtime defect: shared and isolated Codex runtimes could construct mutually exclusive approval and sandbox flags, obscure pre-session CLI failures behind a missing-result error, and overstate sandbox application before thread start. The working-tree fix establishes a fail-closed exclusive policy, truthful receipts, startup error precedence, and synthetic regression coverage; immutable release and original Engine retry evidence remain separate resolution gates."},"issueId":"AH-20260914-B5475E479753","protocolVersion":"1.0","revision":1,"triageDigest":"48bf321444e5a39bdb8bad0a72389abb31a07943f75f43e727e7256c4ef49bfe","updatedAt":"2026-09-14T11:21:27.489Z"}
