{"commands":{"triage_visible_host_root_20260915":{"authorityDecision":{"action":"triage-and-implement-visible-host-fix","actor":"user","decision":"approved","reason":"用户明确要求全部修复、一次性交付。","source":"current-thread"},"commandId":"triage_visible_host_root_20260915","committedAt":"2026-09-15T14:56:37.599Z","payloadDigest":"4316925e8b36a40bf6eb5e4d6dd33d1bfea84a04c4981ab39054cb802ae58410","revision":1}},"disposition":{"classification":"defect","relations":[{"target":"AH-20260915-570C48837B4E","type":"related-to"}],"resolutionEvidence":["code:codex-collaboration-native@1.1.0 exact spawn/list/wait/interrupt contract","code:Codex Host Effect Journal with expected revision, idempotent commands, atomic commits and crash reconciliation","test:npm test 190/190 passed on 2026-09-15","gate:npm run check; test:conformance; test:canary; check:clean-room; pack:dry-run; check:residue all passed"],"severity":"P1","status":"accepted","summary":"已确认共享 Codex collaboration Host Adapter 存在真实协议错误与 spawn-before-Lease 外部副作用事务缺口；本地修复已完成并通过全量交付 Gate，待用户另行授权 commit、发布、激活及真实产品 Host canary 后转 resolved。"},"issueId":"AH-20260915-5323CEA6386F","protocolVersion":"1.0","revision":1,"triageDigest":"73e67a66acafb08f62a39f7d29082dfc7ef5a21b8e64c043da68e6258168cf6a","updatedAt":"2026-09-15T14:56:37.599Z"}
