{"commands":{"triage_w3_AH-20260915-F9C3FC2090F4":{"authorityDecision":{"action":"triage-harness-issues","actor":"project-owner","decision":"approved","source":"current-thread"},"commandId":"triage_w3_AH-20260915-F9C3FC2090F4","committedAt":"2026-09-23T00:20:02.356Z","payloadDigest":"2265b21d7cacb24d671c61b8012a1a1ce6b995d538ecf4885fe3566966044d0b","revision":1}},"disposition":{"classification":"defect","relations":[],"resolutionEvidence":[],"severity":"P1","status":"accepted","summary":"V3.8.4 quality 因 Project Descriptor 记录无效与扩展制品摘要不匹配被阻断；已由 Descriptor/Registry 摘要绑定修复，真实复验待执行。"},"issueId":"AH-20260915-F9C3FC2090F4","protocolVersion":"1.0","revision":1,"triageDigest":"b23b4f391490e28738b5529043378b9e2de5c4aa3db2d93c43a1405ef82d62dc","updatedAt":"2026-09-23T00:20:02.356Z"}
