{"commands":{"triage_visible_host_supplement_20260915":{"authorityDecision":{"action":"triage-and-implement-visible-host-fix","actor":"user","decision":"approved","reason":"用户明确要求全部修复、一次性交付。","source":"current-thread"},"commandId":"triage_visible_host_supplement_20260915","committedAt":"2026-09-15T14:56:50.777Z","payloadDigest":"dcc2f5c4c1c6a5203be9aeddecea6219a538e0c8dc654000b24471b77e596c9d","revision":1}},"disposition":{"classification":"defect","relations":[{"target":"AH-20260915-5323CEA6386F","type":"duplicate-of"}],"resolutionEvidence":["test:spawn-before-bind failure contains the prior Agent and never opens the next Agent","test:preflight reconciliation contains a crash-window Agent before any later spawn","test:every Engine and Collection state-changing action shares the conversation-visible Host Contract path by default"],"severity":"P1","status":"duplicate","summary":"补充观察与原问题具有同一 incident fingerprint；其未等待、未收容和共性影响均已并入 AH-20260915-5323CEA6386F 的统一修复与验收范围。"},"issueId":"AH-20260915-570C48837B4E","protocolVersion":"1.0","revision":1,"triageDigest":"0bfa41f0d66b041f09795d02e13949e79bd398df6fb847b501ae3ff7cee6d5f2","updatedAt":"2026-09-15T14:56:50.777Z"}
