{"commands":{"resolve-AH-20260915-8C001F4D266E-e296443b":{"authorityDecision":{"action":"resolve-issue","actor":"project-owner","decision":"approved","reason":"User authorized fixing all identified issues and completing rebuild, activation, and plugin reinstall.","source":"AH-20260915-8C001F4D266E"},"commandId":"resolve-AH-20260915-8C001F4D266E-e296443b","committedAt":"2026-09-15T07:08:00.000Z","payloadDigest":"bf5ba37d96b839683dc4e9a559f35262821ecb4a729c5cc992e22404e143016d","revision":1},"triage_w3_reopen_AH-20260915-8C001F4D266E":{"authorityDecision":{"action":"triage-harness-issues","actor":"project-owner","decision":"approved","source":"current-thread"},"commandId":"triage_w3_reopen_AH-20260915-8C001F4D266E","committedAt":"2026-09-23T00:20:02.412Z","payloadDigest":"bc411902b57b1fe41f243853b81d8da2d15340f39866acf9a0fa2806a56b97d4","revision":2}},"disposition":{"classification":"deployment-incident","relations":[{"target":"AH-20260915-3218A00AAEFB","type":"successor-of"},{"target":"AH-20260915-43658BE83791","type":"related-to"}],"resolutionEvidence":["issue-analysis:AH-20260915-3218A00AAEFB/resolution-plan.md","issue-analysis:AH-20260915-43658BE83791/resolution-plan.md"],"severity":"P1","status":"reopened","summary":"原 resolved 关闭 Gate 失效：以获授权 headless/codex-cli-runtime 替代可信可见路径并绕过原验收条件，随后由 3218A0 与 4365 复发证实。"},"issueId":"AH-20260915-8C001F4D266E","protocolVersion":"1.0","revision":2,"triageDigest":"4d2cb4d0fe647b35d7400bd2439d803dd51f84e07b9e30d3d6c88a768202985b","updatedAt":"2026-09-23T00:20:02.412Z"}
