{"commands":{"triage_w3_AH-20260915-43658BE83791":{"authorityDecision":{"action":"triage-harness-issues","actor":"project-owner","decision":"approved","source":"current-thread"},"commandId":"triage_w3_AH-20260915-43658BE83791","committedAt":"2026-09-23T00:20:02.321Z","payloadDigest":"43e655203ce6fd3abce266856079d17dc1d0418b1c8b58145b46a9f1fdaaa111","revision":1}},"disposition":{"classification":"deployment-incident","relations":[{"target":"AH-20260915-3218A00AAEFB","type":"related-to"},{"target":"AH-20260915-8C001F4D266E","type":"related-to"}],"resolutionEvidence":[],"severity":"P1","status":"accepted","summary":"活动 Runtime/Registry generation 仍停留在回归提交 5eeba78，交互式 quality 继续走后台 CLI；源码与 Skill 已修但部署切换与真实复验未执行。"},"issueId":"AH-20260915-43658BE83791","protocolVersion":"1.0","revision":1,"triageDigest":"59afea8fa08ebdcddf5167223679a7a7f9409af1b7fd0061cd6e383e2fe56003","updatedAt":"2026-09-23T00:20:02.321Z"}
