{"commands":{"triage_w3_AH-20260920-D5F65D00699B":{"authorityDecision":{"action":"triage-harness-issues","actor":"project-owner","decision":"approved","source":"current-thread"},"commandId":"triage_w3_AH-20260920-D5F65D00699B","committedAt":"2026-09-23T00:20:02.400Z","payloadDigest":"9d576b252cd1d58333299fa62d10d23db51df69a88d6621c578ae04652dbaf69","revision":1}},"disposition":{"classification":"defect","relations":[{"target":"AH-20260920-AB121AD18464","type":"related-to"},{"target":"AH-20260920-A79DB71DEA40","type":"related-to"}],"resolutionEvidence":[],"severity":"P1","status":"accepted","summary":"可见宿主传输与对账拒绝已完成的 quality 结果，阻塞 review Submission 与 repair Dispatch；已由结果传输与库存计划修复，真实宿主复验待执行。"},"issueId":"AH-20260920-D5F65D00699B","protocolVersion":"1.0","revision":1,"triageDigest":"8f1f1b76c8948ddf0a6dcc534170d46e00915fe127c9738e731787bdf546cf7e","updatedAt":"2026-09-23T00:20:02.400Z"}
