{"commands":{"triage_w3_AH-20260914-F16B3EBB0898":{"authorityDecision":{"action":"triage-harness-issues","actor":"project-owner","decision":"approved","source":"current-thread"},"commandId":"triage_w3_AH-20260914-F16B3EBB0898","committedAt":"2026-09-23T00:20:02.298Z","payloadDigest":"ef191f1e4da3d0575ffcf83353af9ff72c663e05c1f5444d489ab79336ef03f0","revision":1}},"disposition":{"classification":"defect","relations":[{"target":"AH-20260920-AB121AD18464","type":"related-to"}],"resolutionEvidence":[],"severity":"P1","status":"accepted","summary":"Codex Runtime 因 changedFiles schema 使用 uniqueItems 而拒绝输出；已改为兼容的受管结果 Schema，真实宿主复验待执行。"},"issueId":"AH-20260914-F16B3EBB0898","protocolVersion":"1.0","revision":1,"triageDigest":"6a3963e99571a1bc4bdd0dfdfcc65a44ab3f365744addd9d8bc6286bd555d0cc","updatedAt":"2026-09-23T00:20:02.298Z"}
