{"commands":{"triage_AH_20260913_AB2DBEDCE37B":{"authorityDecision":{"action":"close-related-harness-issues","actor":"project-owner","decision":"approved","source":"current-thread"},"commandId":"triage_AH_20260913_AB2DBEDCE37B","committedAt":"2026-09-13T14:53:26.541Z","payloadDigest":"912ec0fc51545117519dddf6910765468501c2c443f261852c790093f2417210","revision":1}},"disposition":{"classification":"deployment-incident","relations":[{"target":"AH-20260913-DA8CA73021DB","type":"duplicate-of"}],"resolutionEvidence":[],"severity":"P1","status":"duplicate","summary":"与 AH-20260913-DA8CA73021DB 为同一首次观察，保留不可变 Intake 并以关系状态去重。"},"issueId":"AH-20260913-AB2DBEDCE37B","protocolVersion":"1.0","revision":1,"triageDigest":"659294c7c5d508088e0093cba4c9a1c77e7be3a38f8b86a2c2c7ec216565035a","updatedAt":"2026-09-13T14:53:26.541Z"}
